{
  "specVersion": 1,
  "mapDataSourcePolicyVersion": 1,
  "orientation": "portrait",
  "targetAspectRatio": "9:16",
  "referenceImagesAreVisualSourceOfTruth": true,
  "referenceImagesAreNotDataSource": true,
  "referenceDirectory": "docs/design/map-v2/references/",
  "howToAddFiles": "docs/design/map-v2/references/README.md",
  "legacyStableGameplayCityIds": [
    "izmir",
    "istanbul",
    "ankara",
    "bursa",
    "antalya",
    "adana",
    "diyarbakir",
    "trabzon"
  ],
  "screens": [
    {
      "id": "MAP-01",
      "name": "World Map",
      "status": "PENDING_REFERENCE_FILE",
      "referenceFile": null,
      "orientation": "portrait",
      "targetAspectRatio": "9:16",
      "purpose": "Global company expansion overview",
      "entryPoints": ["main-tab-map", "MAP-02-up", "MAP-08-cancel", "MAP-09-back"],
      "exitPoints": ["MAP-02", "MAP-03", "MAP-08", "MAP-09", "tab-contracts", "tab-dashboard"],
      "parentView": null,
      "childViews": ["MAP-02", "MAP-03", "MAP-08", "MAP-09"],
      "requiredUIRegions": ["map-viewport", "geographic-level-indicator", "selected-country-chrome"],
      "optionalUIRegions": ["global-status-summary", "layer-controls"],
      "mapLayers": ["BASE_GEOGRAPHY", "COUNTRY_BOUNDARIES", "LOCK_STATE", "SELECTION", "LABELS", "AIR_NETWORK"],
      "interactionTypes": ["select-country", "open-country", "open-expansion", "pan-zoom-later"],
      "dataDependencies": ["country-display-polygons-future", "unlock-state-future"],
      "visualPriority": "map-first-aggressive-lod",
      "notes": "Hide cities, local roads, warehouses. No all-routes. Direct World to Türkiye allowed."
    },
    {
      "id": "MAP-02",
      "name": "Region / Europe View",
      "status": "PENDING_REFERENCE_FILE",
      "referenceFile": null,
      "orientation": "portrait",
      "targetAspectRatio": "9:16",
      "purpose": "Optional bridge between world and country detail",
      "entryPoints": ["MAP-01"],
      "exitPoints": ["MAP-01", "MAP-03", "MAP-08"],
      "parentView": "MAP-01",
      "childViews": ["MAP-03"],
      "requiredUIRegions": ["map-viewport", "country-labels", "selection"],
      "optionalUIRegions": ["hub-markers", "limited-international-routes"],
      "mapLayers": ["BASE_GEOGRAPHY", "COUNTRY_BOUNDARIES", "REGION_BOUNDARIES", "CITY_MARKERS", "LOCK_STATE", "SELECTION", "LABELS"],
      "interactionTypes": ["select-country", "skip-to-MAP-03"],
      "dataDependencies": ["country-availability-future"],
      "visualPriority": "countries-over-local-networks",
      "notes": "Optional in navigation. Do not force Europe on the way to Türkiye."
    },
    {
      "id": "MAP-03",
      "name": "Country View / Türkiye",
      "status": "PENDING_REFERENCE_FILE",
      "referenceFile": null,
      "orientation": "portrait",
      "targetAspectRatio": "9:16",
      "purpose": "Primary country logistics operations; successor visual context of live MapScreen",
      "entryPoints": ["MAP-01", "MAP-02", "main-tab-map-during-migration"],
      "exitPoints": ["MAP-01", "MAP-04", "MAP-05", "MAP-06", "MAP-07", "tab-contracts", "tab-fleet"],
      "parentView": "MAP-01",
      "childViews": ["MAP-04", "MAP-05", "MAP-06", "MAP-07"],
      "requiredUIRegions": ["map-viewport", "playable-city-markers-future", "active-vehicle-overlay", "tracking-or-sheet"],
      "optionalUIRegions": ["filter-tabs", "stats-strip", "recommended-contract-row", "layer-controls"],
      "mapLayers": ["BASE_GEOGRAPHY", "COUNTRY_BOUNDARIES", "CITY_MARKERS", "ROAD_NETWORK", "ACTIVE_CONTRACTS", "ACTIVE_VEHICLES", "SELECTION", "LABELS", "INFRASTRUCTURE"],
      "interactionTypes": ["select-city-future", "track-delivery", "open-contracts", "open-fleet", "pan-pinch"],
      "dataDependencies": ["legacy-stable-gameplay-city-ids", "routes-gameplay-graph", "active-deliveries"],
      "visualPriority": "playable-network-plus-active-jobs",
      "notes": "Do not claim 81 provinces playable. Geographic labels vs playable cities."
    },
    {
      "id": "MAP-04",
      "name": "City / Local Operations View",
      "status": "PENDING_REFERENCE_FILE",
      "referenceFile": null,
      "orientation": "portrait",
      "targetAspectRatio": "9:16",
      "purpose": "Local facilities and activity for one playable city",
      "entryPoints": ["MAP-03"],
      "exitPoints": ["MAP-03", "warehouse-screen-later", "tab-contracts"],
      "parentView": "MAP-03",
      "childViews": [],
      "requiredUIRegions": ["level-indicator", "facility-list-or-schematic"],
      "optionalUIRegions": ["local-map-geometry", "port-or-airport-if-applicable"],
      "mapLayers": ["INFRASTRUCTURE", "CITY_MARKERS", "ACTIVE_CONTRACTS", "LOCK_STATE", "SELECTION", "LABELS"],
      "interactionTypes": ["select-facility-future", "back-to-country"],
      "dataDependencies": ["gameplayCityId", "player-warehouses"],
      "visualPriority": "operations-over-national-geography",
      "notes": "Per-city unique geometry is an unresolved implementation decision. No invented real infrastructure."
    },
    {
      "id": "MAP-05",
      "name": "Rail Network View",
      "status": "PENDING_REFERENCE_FILE",
      "referenceFile": null,
      "orientation": "portrait",
      "targetAspectRatio": "9:16",
      "purpose": "Rail logistics/network management UI (future)",
      "entryPoints": ["MAP-03", "MAP-07"],
      "exitPoints": ["MAP-03", "MAP-07"],
      "parentView": "MAP-03",
      "childViews": [],
      "requiredUIRegions": ["rail-styled-network", "hub-list-or-markers", "legend"],
      "optionalUIRegions": ["train-movement", "owned-infra-badges"],
      "mapLayers": ["BASE_GEOGRAPHY", "RAIL_NETWORK", "INFRASTRUCTURE", "LOCK_STATE", "SELECTION", "LABELS"],
      "interactionTypes": ["select-hub-future", "toggle-rail-layer"],
      "dataDependencies": ["future-rail-mapdata-tcdd-verified"],
      "visualPriority": "rail-distinct-from-road",
      "notes": "Do not copy AI rail geography. No rail gameplay in this phase."
    },
    {
      "id": "MAP-06",
      "name": "Port / Maritime Management View",
      "status": "PENDING_REFERENCE_FILE",
      "referenceFile": null,
      "orientation": "portrait",
      "targetAspectRatio": "9:16",
      "purpose": "Port and maritime operations UI (future)",
      "entryPoints": ["MAP-03", "MAP-07"],
      "exitPoints": ["MAP-03", "MAP-07"],
      "parentView": "MAP-03",
      "childViews": [],
      "requiredUIRegions": ["port-focus", "maritime-path-style", "status-panel-future"],
      "optionalUIRegions": ["ship-markers", "capacity-ui-no-numbers-in-this-spec"],
      "mapLayers": ["BASE_GEOGRAPHY", "SEA_NETWORK", "INFRASTRUCTURE", "LOCK_STATE", "SELECTION", "LABELS"],
      "interactionTypes": ["select-port-future"],
      "dataDependencies": ["TURKEY_PORT_AUTHORITY_SOURCE-PENDING_VERIFICATION"],
      "visualPriority": "water-and-port-over-inland-roads",
      "notes": "No port registry. Port Level 50 is future-facing only."
    },
    {
      "id": "MAP-07",
      "name": "Multimodal Network View",
      "status": "PENDING_REFERENCE_FILE",
      "referenceFile": null,
      "orientation": "portrait",
      "targetAspectRatio": "9:16",
      "purpose": "Visualize multi-leg shipments across transport modes",
      "entryPoints": ["MAP-03", "MAP-05", "MAP-06"],
      "exitPoints": ["MAP-03", "MAP-05", "MAP-06"],
      "parentView": "MAP-03",
      "childViews": [],
      "requiredUIRegions": ["mode-legend", "handoff-markers", "leg-list"],
      "optionalUIRegions": ["active-shipment-highlight"],
      "mapLayers": ["ROAD_NETWORK", "RAIL_NETWORK", "SEA_NETWORK", "AIR_NETWORK", "INFRASTRUCTURE", "ACTIVE_CONTRACTS", "SELECTION", "LABELS"],
      "interactionTypes": ["inspect-leg-future"],
      "dataDependencies": ["future-multimodal-job-state"],
      "visualPriority": "mode-handoffs-over-full-mesh",
      "notes": "Styling only. Example ROAD→RAIL→SEA→ROAD. No routing engine."
    },
    {
      "id": "MAP-08",
      "name": "Expansion / Unlock View",
      "status": "PENDING_REFERENCE_FILE",
      "referenceFile": null,
      "orientation": "portrait",
      "targetAspectRatio": "9:16",
      "purpose": "Country/region expansion decisions",
      "entryPoints": ["MAP-01", "MAP-02"],
      "exitPoints": ["MAP-01", "MAP-03"],
      "parentView": "MAP-01",
      "childViews": [],
      "requiredUIRegions": ["locked-available-countries", "requirements-panel", "confirm-cancel"],
      "optionalUIRegions": ["strategic-copy-no-economy-numbers"],
      "mapLayers": ["BASE_GEOGRAPHY", "COUNTRY_BOUNDARIES", "LOCK_STATE", "SELECTION", "LABELS"],
      "interactionTypes": ["review-unlock-future", "cancel"],
      "dataDependencies": ["future-unlock-rules-not-invented-here"],
      "visualPriority": "decision-panel-plus-map-context",
      "notes": "No economy values. Do not change current economy."
    },
    {
      "id": "MAP-09",
      "name": "Global Network / Endgame View",
      "status": "PENDING_REFERENCE_FILE",
      "referenceFile": null,
      "orientation": "portrait",
      "targetAspectRatio": "9:16",
      "purpose": "Late-game visualization of authoritative company network",
      "entryPoints": ["MAP-01"],
      "exitPoints": ["MAP-01"],
      "parentView": "MAP-01",
      "childViews": [],
      "requiredUIRegions": ["sparse-world-map", "corridor-summary"],
      "optionalUIRegions": ["mode-mix-chart", "reach-stats"],
      "mapLayers": ["BASE_GEOGRAPHY", "COUNTRY_BOUNDARIES", "AIR_NETWORK", "SEA_NETWORK", "ROAD_NETWORK", "ACTIVE_VEHICLES", "LABELS"],
      "interactionTypes": ["inspect-corridor-future"],
      "dataDependencies": ["authoritative-game-state-later"],
      "visualPriority": "aggressive-lod-summary",
      "notes": "Not a separate simulation. Cull heavily."
    }
  ]
}
